{
  "schema": "tdep/0.1",
  "flight_id": "cccccccc-cccc-4ccc-8ccc-cccccccccccc",
  "buyer_partner_id": "dddddddd-dddd-4ddd-8ddd-dddddddddddd",
  "seller_partner_id": "bbbbbbbb-bbbb-4bbb-8bbb-bbbbbbbbbbbb",
  "face_ids": ["aaaaaaaa-aaaa-4aaa-8aaa-aaaaaaaaaaaa"],
  "creative_ids": ["eeeeeeee-eeee-4eee-8eee-eeeeeeeeeeee"],
  "priority": "fill",
  "status": "offered",
  "window": {
    "from": "2026-08-23T08:00:00.000Z",
    "until": "2026-08-23T22:00:00.000Z"
  }
}
